{
  "version": "1.0.0",
  "benchmark_name": "ELITEBUILD Enterprise RAG Gold Evaluation Benchmark",
  "updated_at": "2026-10-01T08:00:00Z",
  "test_cases": [
    {
      "test_case_id": "TC-CORP-001",
      "category": "CORPORATE_CREDENTIALS",
      "query": "What is the official legal name and established year of the company?",
      "ground_truth_answer": "The official legal entity name is M/S ELITE CONSTRUCTION COMPANY (Engineers & Constructors), established in 2006.",
      "ground_truth_doc_ids": [
        "doc-company-profile"
      ],
      "ground_truth_chunk_ids": [
        "chk-company-profile-000"
      ],
      "expected_citations": [
        "Company Profile — ELITE CONSTRUCTION COMPANY"
      ],
      "expected_status": "SUPPORTED",
      "required_security_level": "PUBLIC"
    },
    {
      "test_case_id": "TC-CORP-002",
      "category": "CORPORATE_CREDENTIALS",
      "query": "What Pakistan Engineering Council (PEC) licensing category does Elite Construction Company hold?",
      "ground_truth_answer": "Elite Construction Company holds PEC Category C-1 (No Limit) registration, authorizing it for unlimited financial value civil engineering and highway works.",
      "ground_truth_doc_ids": [
        "doc-credential-pakistan-engineering-council-pec-license"
      ],
      "ground_truth_chunk_ids": [
        "chk-credential-pakistan-engineering-council-pec-license-000"
      ],
      "expected_citations": [
        "Credential — Pakistan Engineering Council (PEC) License"
      ],
      "expected_status": "SUPPORTED",
      "required_security_level": "PUBLIC"
    },
    {
      "test_case_id": "TC-CORP-003",
      "category": "CORPORATE_CREDENTIALS",
      "query": "Where are the primary and secondary registered offices of Elite Construction Company located?",
      "ground_truth_answer": "The primary office is located at Hamza Tower, F-11 Markaz, Islamabad, and the secondary office is at Jawad Tower, University Road, Peshawar, Pakistan.",
      "ground_truth_doc_ids": [
        "doc-company-profile"
      ],
      "ground_truth_chunk_ids": [
        "chk-company-profile-000"
      ],
      "expected_citations": [
        "Company Profile — ELITE CONSTRUCTION COMPANY"
      ],
      "expected_status": "SUPPORTED",
      "required_security_level": "PUBLIC"
    },
    {
      "test_case_id": "TC-CORP-004",
      "category": "CORPORATE_CREDENTIALS",
      "query": "What is the mission of Elite Construction Company?",
      "ground_truth_answer": "To deliver high-grade civil and engineering infrastructure that exceeds regulatory standards, maintains durability, and serves the long-term strategic needs of our clients and communities.",
      "ground_truth_doc_ids": [
        "doc-company-profile"
      ],
      "ground_truth_chunk_ids": [
        "chk-company-profile-000"
      ],
      "expected_citations": [
        "Company Profile — ELITE CONSTRUCTION COMPANY"
      ],
      "expected_status": "SUPPORTED",
      "required_security_level": "PUBLIC"
    },
    {
      "test_case_id": "TC-CORP-005",
      "category": "CORPORATE_CREDENTIALS",
      "query": "What is the corporate vision of Elite Construction Company?",
      "ground_truth_answer": "To be recognized as a premier engineering and contracting enterprise in Pakistan, distinguished by technical rigor, transparent execution, and structural integrity.",
      "ground_truth_doc_ids": [
        "doc-company-profile"
      ],
      "ground_truth_chunk_ids": [
        "chk-company-profile-000"
      ],
      "expected_citations": [
        "Company Profile — ELITE CONSTRUCTION COMPANY"
      ],
      "expected_status": "SUPPORTED",
      "required_security_level": "PUBLIC"
    },
    {
      "test_case_id": "TC-CORP-006",
      "category": "CORPORATE_CREDENTIALS",
      "query": "What government enlistment does Elite Construction Company hold with the Communication & Works Department?",
      "ground_truth_answer": "Elite Construction Company holds prequalified contractor enlistment with the Communication & Works (C&W) Department, Government of Khyber Pakhtunkhwa, for provincial infrastructure, roads, and building construction contracts.",
      "ground_truth_doc_ids": [
        "doc-credential-communication-&-works-c&w-contractor-enlist"
      ],
      "ground_truth_chunk_ids": [
        "chk-credential-communication-&-works-c&w-contractor-enlist-000"
      ],
      "expected_citations": [
        "Credential — Communication & Works (C&W) Contractor Enlistment"
      ],
      "expected_status": "SUPPORTED",
      "required_security_level": "PUBLIC"
    },
    {
      "test_case_id": "TC-CORP-007",
      "category": "CORPORATE_CREDENTIALS",
      "query": "Which institutional client bodies and government departments has Elite Construction Company worked with?",
      "ground_truth_answer": "Documented institutional clients include the Communication & Works Department (C&W), Military Engineering Services (MES), Peshawar Development Authority (PDA), Islamabad / Tribal Electric Supply Companies (IESCO / TESCO), and public-sector universities.",
      "ground_truth_doc_ids": [
        "doc-client-organizations"
      ],
      "ground_truth_chunk_ids": [
        "chk-client-organizations-000"
      ],
      "expected_citations": [
        "Client Organizations — Elite Construction Company"
      ],
      "expected_status": "SUPPORTED",
      "required_security_level": "PUBLIC"
    },
    {
      "test_case_id": "TC-CORP-008",
      "category": "CORPORATE_CREDENTIALS",
      "query": "What capabilities and scope are included in Elite's Civil Construction service?",
      "ground_truth_answer": "Comprehensive civil construction capabilities encompassing highway and road corridors, reinforced concrete bridges, drainage networks, institutional and administrative structures, and complex civil engineering groundworks.",
      "ground_truth_doc_ids": [
        "doc-service-civil-construction"
      ],
      "ground_truth_chunk_ids": [
        "chk-service-civil-construction-000"
      ],
      "expected_citations": [
        "Service — Civil Construction"
      ],
      "expected_status": "SUPPORTED",
      "required_security_level": "PUBLIC"
    },
    {
      "test_case_id": "TC-CORP-009",
      "category": "CORPORATE_CREDENTIALS",
      "query": "What does Elite Construction Company offer under Rehabilitation and Maintenance services?",
      "ground_truth_answer": "Restoration and life-extension of aging civil infrastructure, including emergency rural road rehabilitation, structural repairs, pavement re-carpeting, drainage de-silting, and preventive facility maintenance.",
      "ground_truth_doc_ids": [
        "doc-service-rehabilitation-maintenance"
      ],
      "ground_truth_chunk_ids": [
        "chk-service-rehabilitation-maintenance-000"
      ],
      "expected_citations": [
        "Service — Rehabilitation & Maintenance"
      ],
      "expected_status": "SUPPORTED",
      "required_security_level": "PUBLIC"
    },
    {
      "test_case_id": "TC-CORP-010",
      "category": "CORPORATE_CREDENTIALS",
      "query": "What project management services does Elite Construction Company provide?",
      "ground_truth_answer": "Technical project management adhering to engineering contracts, quality assurance protocols, site supervision, material testing, milestone tracking, and governmental compliance.",
      "ground_truth_doc_ids": [
        "doc-service-project-management"
      ],
      "ground_truth_chunk_ids": [
        "chk-service-project-management-000"
      ],
      "expected_citations": [
        "Service — Project Management"
      ],
      "expected_status": "SUPPORTED",
      "required_security_level": "PUBLIC"
    },
    {
      "test_case_id": "TC-PROJ-001",
      "category": "CIVIL_INFRASTRUCTURE_PROJECTS",
      "query": "What works were executed for the Dalazak Road repair and rehabilitation project in Peshawar?",
      "ground_truth_answer": "Pavement rehabilitation, sub-base preparation, road surfacing, drainage clearing, and municipal corridor improvement extending from Shabistan Cinema / Hayat Hotel toward Dalazak Road via Sabzi Mandi under Communication & Works / Municipal Authorities.",
      "ground_truth_doc_ids": [
        "doc-project-road-repair-dalazak"
      ],
      "ground_truth_chunk_ids": [
        "chk-project-road-repair-dalazak-000"
      ],
      "expected_citations": [
        "Project — Road Repair & Rehabilitation"
      ],
      "expected_status": "SUPPORTED",
      "required_security_level": "PUBLIC"
    },
    {
      "test_case_id": "TC-PROJ-002",
      "category": "CIVIL_INFRASTRUCTURE_PROJECTS",
      "query": "What was the scope of the Garanga to Sher Killi road improvement project?",
      "ground_truth_answer": "Corridor widening, earthworks, sub-grade stabilization, asphalt/surface dressing, and roadside drainage across the Garanga to Sher Killi corridor in Khyber Pakhtunkhwa.",
      "ground_truth_doc_ids": [
        "doc-project-garanga-sher-killi-road"
      ],
      "ground_truth_chunk_ids": [
        "chk-project-garanga-sher-killi-road-000"
      ],
      "expected_citations": [
        "Project — Garanga–Sher Killi Road Improvement"
      ],
      "expected_status": "SUPPORTED",
      "required_security_level": "PUBLIC"
    },
    {
      "test_case_id": "TC-PROJ-003",
      "category": "CIVIL_INFRASTRUCTURE_PROJECTS",
      "query": "Under which program was the Pir Bala to Pir Kala road rehabilitation carried out?",
      "ground_truth_answer": "It was executed under the Khyber Pakhtunkhwa Emergency Rural Road Rehabilitation Project, restoring connectivity, drainage, culvert construction, embankment stabilization, and bituminous surfacing.",
      "ground_truth_doc_ids": [
        "doc-project-pir-bala-to-pir-kala-road"
      ],
      "ground_truth_chunk_ids": [
        "chk-project-pir-bala-to-pir-kala-road-000"
      ],
      "expected_citations": [